{
  "counts": {
    "caid3_reference_entries": 31,
    "disprot_entries": 3337,
    "exact_caid3_overlap_entries": 31,
    "exact_caid3_overlap_regions": 41,
    "explicit_dfl_entries": 360,
    "remaining_entries": 329,
    "remaining_regions": 419,
    "remaining_shared_uniref_entries": 0
  },
  "entries": [
    {
      "caid3_exact_id": false,
      "disprot_id": "DP00009",
      "explicit_dfl_region_ids": [
        "DP00009r002"
      ],
      "shared_caid3_uniref_cluster_fields": [],
      "training_status": "pending_homology_and_label_audit",
      "uniprot_accession": "P32774"
    },
    {
      "caid3_exact_id": false,
      "disprot_id": "DP00011",
      "explicit_dfl_region_ids": [
        "DP00011r005"
      ],
      "shared_caid3_uniref_cluster_fields": [],
      "training_status": "pending_homology_and_label_audit",
      "uniprot_accession": "P0DMM9"
    },
    {
      "caid3_exact_id": false,
      "disprot_id": "DP00018",
      "explicit_dfl_region_ids": [
        "DP00018r002"
      ],
      "shared_caid3_uniref_cluster_fields": [],
      "training_status": "pending_homology_and_label_audit",
      "uniprot_accession": "P46527"
    },
    {
      "caid3_exact_id": false,
      "disprot_id": "DP00023",
      "explicit_dfl_region_ids": [
        "DP00023r006"
      ],
      "shared_caid3_uniref_cluster_fields": [],
      "training_status": "pending_homology_and_label_audit",
      "uniprot_accession": "P14061"
    },
    {
      "caid3_exact_id": false,
      "disprot_id": "DP00034",
      "explicit_dfl_region_ids": [
        "DP00034r004"
      ],
      "shared_caid3_uniref_cluster_fields": [],
      "training_status": "pending_homology_and_label_audit",
      "uniprot_accession": "P03661"
    },
    {
      "caid3_exact_id": false,
      "disprot_id": "DP00040",
      "explicit_dfl_region_ids": [
        "DP00040r029"
      ],
      "shared_caid3_uniref_cluster_fields": [],
      "training_status": "pending_homology_and_label_audit",
      "uniprot_accession": "P17096"
    },
    {
      "caid3_exact_id": false,
      "disprot_id": "DP00048",
      "explicit_dfl_region_ids": [
        "DP00048r012"
      ],
      "shared_caid3_uniref_cluster_fields": [],
      "training_status": "pending_homology_and_label_audit",
      "uniprot_accession": "P03406"
    },
    {
      "caid3_exact_id": false,
      "disprot_id": "DP00061",
      "explicit_dfl_region_ids": [
        "DP00061r006",
        "DP00061r008"
      ],
      "shared_caid3_uniref_cluster_fields": [],
      "training_status": "pending_homology_and_label_audit",
      "uniprot_accession": "P27694"
    },
    {
      "caid3_exact_id": false,
      "disprot_id": "DP00075",
      "explicit_dfl_region_ids": [
        "DP00075r006"
      ],
      "shared_caid3_uniref_cluster_fields": [],
      "training_status": "pending_homology_and_label_audit",
      "uniprot_accession": "P11387"
    },
    {
      "caid3_exact_id": false,
      "disprot_id": "DP00098",
      "explicit_dfl_region_ids": [
        "DP00098r004"
      ],
      "shared_caid3_uniref_cluster_fields": [],
      "training_status": "pending_homology_and_label_audit",
      "uniprot_accession": "Q53654"
    },
    {
      "caid3_exact_id": false,
      "disprot_id": "DP00111",
      "explicit_dfl_region_ids": [
        "DP00111r002"
      ],
      "shared_caid3_uniref_cluster_fields": [],
      "training_status": "pending_homology_and_label_audit",
      "uniprot_accession": "P27577"
    },
    {
      "caid3_exact_id": false,
      "disprot_id": "DP00133",
      "explicit_dfl_region_ids": [
        "DP00133r038"
      ],
      "shared_caid3_uniref_cluster_fields": [],
      "training_status": "pending_homology_and_label_audit",
      "uniprot_accession": "P03422"
    },
    {
      "caid3_exact_id": false,
      "disprot_id": "DP00135",
      "explicit_dfl_region_ids": [
        "DP00135r005"
      ],
      "shared_caid3_uniref_cluster_fields": [],
      "training_status": "pending_homology_and_label_audit",
      "uniprot_accession": "P10961"
    },
    {
      "caid3_exact_id": false,
      "disprot_id": "DP00156",
      "explicit_dfl_region_ids": [
        "DP00156r002",
        "DP00156r004",
        "DP00156r006"
      ],
      "shared_caid3_uniref_cluster_fields": [],
      "training_status": "pending_homology_and_label_audit",
      "uniprot_accession": "P54725"
    },
    {
      "caid3_exact_id": false,
      "disprot_id": "DP00161",
      "explicit_dfl_region_ids": [
        "DP00161r002"
      ],
      "shared_caid3_uniref_cluster_fields": [],
      "training_status": "pending_homology_and_label_audit",
      "uniprot_accession": "P77173"
    },
    {
      "caid3_exact_id": false,
      "disprot_id": "DP00162",
      "explicit_dfl_region_ids": [
        "DP00162r003"
      ],
      "shared_caid3_uniref_cluster_fields": [],
      "training_status": "pending_homology_and_label_audit",
      "uniprot_accession": "O75324"
    },
    {
      "caid3_exact_id": false,
      "disprot_id": "DP00166",
      "explicit_dfl_region_ids": [
        "DP00166r007"
      ],
      "shared_caid3_uniref_cluster_fields": [],
      "training_status": "pending_homology_and_label_audit",
      "uniprot_accession": "P19429"
    },
    {
      "caid3_exact_id": false,
      "disprot_id": "DP00194",
      "explicit_dfl_region_ids": [
        "DP00194r009"
      ],
      "shared_caid3_uniref_cluster_fields": [],
      "training_status": "pending_homology_and_label_audit",
      "uniprot_accession": "P0AFZ3"
    },
    {
      "caid3_exact_id": false,
      "disprot_id": "DP00197",
      "explicit_dfl_region_ids": [
        "DP00197r002"
      ],
      "shared_caid3_uniref_cluster_fields": [],
      "training_status": "pending_homology_and_label_audit",
      "uniprot_accession": "P0A707"
    },
    {
      "caid3_exact_id": false,
      "disprot_id": "DP00226",
      "explicit_dfl_region_ids": [
        "DP00226r007"
      ],
      "shared_caid3_uniref_cluster_fields": [],
      "training_status": "pending_homology_and_label_audit",
      "uniprot_accession": "Q9CXW3"
    },
    {
      "caid3_exact_id": false,
      "disprot_id": "DP00231",
      "explicit_dfl_region_ids": [
        "DP00231r008"
      ],
      "shared_caid3_uniref_cluster_fields": [],
      "training_status": "pending_homology_and_label_audit",
      "uniprot_accession": "P14859"
    },
    {
      "caid3_exact_id": false,
      "disprot_id": "DP00243",
      "explicit_dfl_region_ids": [
        "DP00243r002"
      ],
      "shared_caid3_uniref_cluster_fields": [],
      "training_status": "pending_homology_and_label_audit",
      "uniprot_accession": "P23025"
    },
    {
      "caid3_exact_id": false,
      "disprot_id": "DP00284",
      "explicit_dfl_region_ids": [
        "DP00284r010"
      ],
      "shared_caid3_uniref_cluster_fields": [],
      "training_status": "pending_homology_and_label_audit",
      "uniprot_accession": "P16009"
    },
    {
      "caid3_exact_id": false,
      "disprot_id": "DP00298",
      "explicit_dfl_region_ids": [
        "DP00298r002",
        "DP00298r004"
      ],
      "shared_caid3_uniref_cluster_fields": [],
      "training_status": "pending_homology_and_label_audit",
      "uniprot_accession": "Q07817"
    },
    {
      "caid3_exact_id": false,
      "disprot_id": "DP00315",
      "explicit_dfl_region_ids": [
        "DP00315r005",
        "DP00315r007",
        "DP00315r009"
      ],
      "shared_caid3_uniref_cluster_fields": [],
      "training_status": "pending_homology_and_label_audit",
      "uniprot_accession": "O43464"
    },
    {
      "caid3_exact_id": false,
      "disprot_id": "DP00324",
      "explicit_dfl_region_ids": [
        "DP00324r003",
        "DP00324r013"
      ],
      "shared_caid3_uniref_cluster_fields": [],
      "training_status": "pending_homology_and_label_audit",
      "uniprot_accession": "P09651"
    },
    {
      "caid3_exact_id": false,
      "disprot_id": "DP00352",
      "explicit_dfl_region_ids": [
        "DP00352r004",
        "DP00352r005"
      ],
      "shared_caid3_uniref_cluster_fields": [],
      "training_status": "pending_homology_and_label_audit",
      "uniprot_accession": "O33599"
    },
    {
      "caid3_exact_id": false,
      "disprot_id": "DP00359",
      "explicit_dfl_region_ids": [
        "DP00359r007"
      ],
      "shared_caid3_uniref_cluster_fields": [],
      "training_status": "pending_homology_and_label_audit",
      "uniprot_accession": "A6Q0K5"
    },
    {
      "caid3_exact_id": false,
      "disprot_id": "DP00363",
      "explicit_dfl_region_ids": [
        "DP00363r002"
      ],
      "shared_caid3_uniref_cluster_fields": [],
      "training_status": "pending_homology_and_label_audit",
      "uniprot_accession": "Q16222"
    },
    {
      "caid3_exact_id": false,
      "disprot_id": "DP00377",
      "explicit_dfl_region_ids": [
        "DP00377r004"
      ],
      "shared_caid3_uniref_cluster_fields": [],
      "training_status": "pending_homology_and_label_audit",
      "uniprot_accession": "P45577"
    },
    {
      "caid3_exact_id": false,
      "disprot_id": "DP00407",
      "explicit_dfl_region_ids": [
        "DP00407r002",
        "DP00407r004"
      ],
      "shared_caid3_uniref_cluster_fields": [],
      "training_status": "pending_homology_and_label_audit",
      "uniprot_accession": "P07363"
    },
    {
      "caid3_exact_id": false,
      "disprot_id": "DP00410",
      "explicit_dfl_region_ids": [
        "DP00410r011",
        "DP00410r012"
      ],
      "shared_caid3_uniref_cluster_fields": [],
      "training_status": "pending_homology_and_label_audit",
      "uniprot_accession": "P12497"
    },
    {
      "caid3_exact_id": false,
      "disprot_id": "DP00415",
      "explicit_dfl_region_ids": [
        "DP00415r002"
      ],
      "shared_caid3_uniref_cluster_fields": [],
      "training_status": "pending_homology_and_label_audit",
      "uniprot_accession": "P0ABE0"
    },
    {